{
  "$schema": "https://json-schema.org/draft/2020-12/schema",
  "$id": "https://tryashley.ai/contracts/audit_export.schema.json",
  "title": "AuditExport",
  "description": "Manifest of an audit export pack for one organization, period, and jurisdiction: which instrument versions were in use, selection rates and impact ratios per group, the deletion log, and disclosure counts.",
  "type": "object",
  "additionalProperties": false,
  "required": [
    "export_id", "org_id", "generated_at", "period", "jurisdiction", "instruments",
    "selection_rates", "deletion_log", "disclosure_receipts_count", "notices_sent"
  ],
  "properties": {
    "export_id": {"type": "string", "pattern": "^[0-9a-f]{8}-[0-9a-f]{4}-[1-8][0-9a-f]{3}-[89ab][0-9a-f]{3}-[0-9a-f]{12}$"},
    "org_id": {"type": "string", "pattern": "^org_[A-Za-z0-9]{6,}$"},
    "generated_at": {"type": "string", "pattern": "^[0-9]{4}-[0-9]{2}-[0-9]{2}T[0-9]{2}:[0-9]{2}:[0-9]{2}(\\.[0-9]+)?(Z|[+-][0-9]{2}:[0-9]{2})$"},
    "period": {
      "type": "object",
      "additionalProperties": false,
      "required": ["from", "to"],
      "properties": {
        "from": {"type": "string", "pattern": "^[0-9]{4}-[0-9]{2}-[0-9]{2}$"},
        "to": {"type": "string", "pattern": "^[0-9]{4}-[0-9]{2}-[0-9]{2}$"}
      }
    },
    "jurisdiction": {"enum": ["US-NYC-LL144", "US-IL-AIVIA", "US-IL-HB3773", "US-CA-ADMT", "EU-AIA"]},
    "instruments": {
      "type": "array",
      "minItems": 1,
      "items": {
        "type": "object",
        "additionalProperties": false,
        "required": ["instrument_id", "version", "content_hash"],
        "properties": {
          "instrument_id": {"type": "string", "pattern": "^[a-z0-9]+(-[a-z0-9]+)*$"},
          "version": {"type": "integer", "minimum": 1},
          "content_hash": {"type": "string", "pattern": "^sha256:[0-9a-f]{64}$"}
        }
      }
    },
    "selection_rates": {
      "type": "array",
      "items": {
        "type": "object",
        "additionalProperties": false,
        "required": ["category", "group", "applicants", "selected", "selection_rate", "impact_ratio", "flagged"],
        "properties": {
          "category": {"type": "string", "minLength": 1},
          "group": {"type": "string", "minLength": 1},
          "applicants": {"type": "integer", "minimum": 0},
          "selected": {"type": "integer", "minimum": 0},
          "selection_rate": {"type": "number", "minimum": 0, "maximum": 1},
          "impact_ratio": {"type": "number", "minimum": 0, "maximum": 1},
          "flagged": {"type": "boolean"}
        }
      }
    },
    "deletion_log": {
      "type": "array",
      "items": {
        "type": "object",
        "additionalProperties": false,
        "required": ["session_id", "requested_at", "completed_at", "scope"],
        "properties": {
          "session_id": {"type": "string", "pattern": "^[0-9a-f]{8}-[0-9a-f]{4}-[1-8][0-9a-f]{3}-[89ab][0-9a-f]{3}-[0-9a-f]{12}$"},
          "requested_at": {"type": "string", "pattern": "^[0-9]{4}-[0-9]{2}-[0-9]{2}T[0-9]{2}:[0-9]{2}:[0-9]{2}(\\.[0-9]+)?(Z|[+-][0-9]{2}:[0-9]{2})$"},
          "completed_at": {"type": "string", "pattern": "^[0-9]{4}-[0-9]{2}-[0-9]{2}T[0-9]{2}:[0-9]{2}:[0-9]{2}(\\.[0-9]+)?(Z|[+-][0-9]{2}:[0-9]{2})$"},
          "scope": {"enum": ["recording", "transcript", "derived-features", "all"]}
        }
      }
    },
    "disclosure_receipts_count": {"type": "integer", "minimum": 0},
    "notices_sent": {"type": "integer", "minimum": 0}
  }
}
